麻烦您提供一下接受短信的手机号，辛苦您了	麻烦您提供一下您接受短信的手机号，辛苦您了	1
稍等的，正在为您转接	辛苦您在线等待下的现在帮您转接的好吗？	1
请问这是什么树的叶子啊？	请问这是什么木头手串，怎样？	0
今天是什么日子，都在放鞭炮	今天是什么节日，这么多放鞭炮的	1
这是什么手机游戏	这是什么手机游戏啊	1
请您核实下您是否有其他的支付宝账户的，辛苦您了	您好，请您核实一下其他的账户是否有的。辛苦您了	1
短发弄什么发型好	男的，短发能做什么发型呢？	0
邮政快递怎么查询	怎么查询邮政快递	1
这个头像大图	求这个头像大图！	1
李小龙为什么那么厉害	李小龙那么瘦怎么那么厉害	0
截然不同什么意思	截然不同的意思是什么	1
求范冰冰的苹果完整版	求范冰冰苹果完整版？谁有	1
怎么在网上找客户？	怎么在网上找资料？	0
传统日本女人穿和服时穿什么样的内衣？	为什么日本女人穿的衣服后面都带一个枕头呢	0
这是什么意思翻译一下	这是什么意思，翻译一下	1
妈蛋是什么意思？	妈蛋什么意思	1
我的世界钻石在哪里得。	坦克世界金币卡哪里买的	0
求一款网页游戏！	找一款网页游戏	1
哪里有卖货架我	哪里有卖货架的？	1
现在最流行的玩具是什么？	现在流行什么玩具？	1
这个兰花是什么品种？	这只兔兔是什么品种？	0
燃气热水器多大合适	燃气热水器排名	0
什么品牌布艺沙发好	什么品牌的裤子好穿	0
为什么把乌龟叫王八？	请问：为什么王八是乌龟	1
肾虚会掉头发吗？	肾虚会掉头发吗，	1
刘德华的女儿叫什么名字啊	她叫什么名字，好喜欢她	0
我的世界中文版下载	哪里可以下载我的世界中文版	0
窥的形近字急急急	放烟花日记400字急急急！	0
周杰伦什么时候结婚	周杰伦什么时候会结婚	1
鼓舞意思是什么	鼓舞是什么意思	1
世界上最难听的是什么歌？	世界上什么歌最难听？	1
麻烦您提供您的姓名），辛苦您了，	请问您是在参加什么活动呢？麻烦您提供一下活动名称，辛苦您了	0
榆林在哪个省？	榆林是哪个省的	1
爱情保证书怎么写	爱情保证书怎么写？	1
周杰伦会和蔡依林结婚嘛？	蔡依林和周杰伦能结婚吗？	1
天天炫斗刷钻石是真的吗？	天天炫斗刷钻石那些是真得吗？	1
网页回合制游戏	回合制网页游戏	1
这是什么电视剧？！	猜你妹，这是什么电影？	0
世界有神仙吗	世界有神仙吗？	1
130***这个手机号是您的吗	137***这个手机号呢？	0
可爱吗、宝宝	我宝宝可爱吗	1
以虫治虫，治什么意思	以虫治虫的治是什么意思	1
百度钱包怎么样？	百度钱包怎么样	1
京东商城怎么付款	京东商城是怎样付款的？	1
就是您绑定的银行卡	建议您解绑您的这张银行卡，再进行重新绑定。	0
是我的淘宝里面可以查看到的哦	账单导入成功，可以在该信用卡还款页面点击该卡一栏查看邮箱账单明细；	0
怎么在微信上制作连接	苹果手机怎么在微信上制作链接	1
谁有这张图的高清大图？	这张图的高清大图	1
哪里有正宗福建辣椒王	哪里卖正宗的福建辣椒王	1
蓝牙耳机充电器多少钱？	苹果五原装耳机多少钱	0
执意的意思是什么？	执意是什么意思？	1
关于易语言进度条	易语言进度条。	1
非常抱歉给您添麻烦了，您的这个是无法核实的，这里是不显示的	很抱歉.您的这个情况小二只能给您这个建议.给您添麻烦了.	0
我是好人。	我想我是好人	1
现在最流行的手机铃声是什么	现在流行什么手机铃声	1
历代的联合国秘书长	联合国现任副秘书长	0
电脑怎么录像？	怎么在电脑上录像	1
移动怎么刷钻	生死狙击刷金币软件怎么用	0
怎样让胡子长得更浓密	怎样让胡子长得浓密点！	1
中国移动没信号	中国移动信号塔	0
形容人吝啬的成语	最难做的饭—成语	0
有哪些国家也过春节?	过春节的国家有哪些	1
奔跑吧兄弟大电影为什么没有邓超？	为什么奔跑吧兄弟大电影，没有邓超	1
中国首富是谁现在？	现在谁是中国首富？	1
广东石油化工学院好不好	广东石油化工学院学校风景	0
我怎样在百度上发帖	怎样在百度上发帖	1
怎么看出自己是不是一个备胎	如何判断自己是否是她的备胎	1
支付宝支付密码忘记怎么办？	支付宝支付密码忘记了	1
屏幕分辨率不对，怎么调，	屏幕分辨率怎么调	1
张家港市属哪里管	杭州下沙属什么区	0
电视剧爱情回来了测	爱情回来了电视剧	1
现在什么生意投资小赚钱快	现在做什么生意投资少风险小，赚钱快	1
求音乐：你是我的眼林宥嘉伴奏	求音乐：情锁陈思安伴奏	0
北京哪里最繁华	北京那里最繁华？	1
开个时尚创意餐吧大概要投资多少	一般开个创意设计工作室要多少钱	0
上海面积多大？	上海到底多大d?	1
2008年奥运会足球项目为什么在开幕式以前进行？	在第几届奥运会上,足球成为了正式比赛项目	0
如何能让脸部皮肤紧致？	如何紧致脸部皮肤	1
怎么制作美电子贺卡	电子贺卡怎么制作	0
什么狗抓兔子	兔子吃什么死	0
什么动物代表悲伤	什么动物代表长寿	0
谁是世界上最聪明的人？	世界上最聪明的人是谁	1
月球的未解之谜	月球还有那些未解之谜	1
为什么玩不了梦幻西游	梦幻西游为什么玩不了？	1
怎样让胸部快速变大	胸部怎样快速变大	1
九阳豆浆机哪里维修	九阳豆浆机在哪里可以维修？	1
有哪些大品牌面膜	面膜有那些品牌好	1
约瑟传说的幻灵兽怎么打？	约瑟传说翼灵兽怎么打	1
这是什么叶子？	这是什么叶子的	1
在线签名设计免费版	签名设计免费版在线，	1
真的十分抱歉，这个是需要账户本人咨询这边才是可以的	真的十分抱歉这个是需要账户本人咨询这边才是可以的。	1
我是歌手李健用的健身器材	我是歌手里李健用的那个健身器材	1
怎么能找到一个人	怎样能找到一个人？	1
安徽含山过年的习俗	安徽过年习俗	0
怎样让头发长得快点?	怎样让头发长得快点，	1
情不自禁，禁是什么意思	情不自禁的禁是什么意思呢？	1
购房合同抵押贷款	购房合同公积金贷款	0
北京798艺术区的各个展区现在还开放吗？	北京798艺术区里面有个技校叫什么名字？	0
找一本都市重生小说	求一本重生都市小说	1
英文怎么读	这个怎么写，英文	0
请大家推荐一部手机	请大家推荐一部手机。	1
用没有什么就没有什么造句	用没有和也不造句	0
什么的小河，	什么的小河？	1
纪念碑谷这关怎么过	问道中妖魔道任务找谁做	0
电脑屏幕上的字体有残影，是怎么回事？	我得电脑屏幕图标总有向右的拖影是怎么回事啊	0
我这个脸型什么发型好看？	这样的脸型剪啥发型好看	1
怎么快速学会唱一首歌？	怎么能快速学会一首歌？	1
怎么做百度推广效果好？	芯漾面膜怎么样？好做么？	0
跑跑卡丁车怎么刷骰子？	跑跑卡丁车怎么刷骰子	1
入团申请书500字左右	入团申请书600字	0
谁看过一部很老的电视剧，	求一首很老日本歌曲	0
求这个情侣头像的另一半谢谢	求情侣头像另一半谢谢	1
孕妇能开车吗	孕妇开车好吗	0
属羊男与属牛女配吗	龙男和虎女配吗	0
这玛瑙是真的吗？	这个玛瑙是真的吗？	1
奥拉星圣光修罗谁来帮我打啊	谁带我打奥拉星圣光修罗伙伴试练	0
这是哪个牌子口红	这是什么牌子的口红	1
孕妇梦见油炸粽子是什么意思	孕妇梦见好多粽子是什么意思？	0
男包什么牌子好呢	男包什么牌子好	1
生理期能洗头吗	月经期能喝咖啡吗	0
四川麻酱麻辣面配方	四川麻辣面	0